{
  "score_version": "dual-track-v1",
  "reference_only": false,
  "id": "deploy-agent-built-static-pages-to-your-own-cloudflare-domai",
  "profile_id": "solo-generalist-v1",
  "analysis_depth": "brief",
  "commercial": {
    "total": null,
    "dimensions": {
      "demand_payment": {
        "score": null,
        "evidence_ids": [],
        "rationale": "目前资料不足以支持该维锚点；未测试并不等于表现为零。",
        "assumptions": [],
        "confidence": "unknown"
      },
      "acquisition": {
        "score": null,
        "evidence_ids": [],
        "rationale": "目前资料不足以支持该维锚点；未测试并不等于表现为零。",
        "assumptions": [],
        "confidence": "unknown"
      },
      "delivery_economics": {
        "score": 2,
        "evidence_ids": [
          "archive",
          "workers",
          "kv"
        ],
        "rationale": "在透明报价、工时、域名与额度假设下有正贡献；未知费用与全年履约风险未测，仅有限规划支持。",
        "assumptions": [],
        "confidence": "low"
      },
      "differentiation": {
        "score": 2,
        "evidence_ids": [
          "archive"
        ],
        "rationale": "归档描述跨模型的自有发布入口与索引便利，缺对照和独有资产，仅限定流程差异。",
        "assumptions": [],
        "confidence": "low"
      },
      "validation_replication": {
        "score": null,
        "evidence_ids": [],
        "rationale": "目前资料不足以支持该维锚点；未测试并不等于表现为零。",
        "assumptions": [],
        "confidence": "unknown"
      }
    }
  },
  "personal": {
    "total": null,
    "dimensions": {
      "audience_frequency": {
        "score": null,
        "evidence_ids": [],
        "rationale": "目前资料不足以支持该维锚点；未测试并不等于表现为零。",
        "assumptions": [],
        "confidence": "unknown"
      },
      "net_benefit": {
        "score": null,
        "evidence_ids": [],
        "rationale": "目前资料不足以支持该维锚点；未测试并不等于表现为零。",
        "assumptions": [],
        "confidence": "unknown"
      },
      "reliability": {
        "score": null,
        "evidence_ids": [],
        "rationale": "目前资料不足以支持该维锚点；未测试并不等于表现为零。",
        "assumptions": [],
        "confidence": "unknown"
      },
      "setup_maintenance": {
        "score": null,
        "evidence_ids": [],
        "rationale": "目前资料不足以支持该维锚点；未测试并不等于表现为零。",
        "assumptions": [],
        "confidence": "unknown"
      },
      "cost_data_control": {
        "score": null,
        "evidence_ids": [],
        "rationale": "目前资料不足以支持该维锚点；未测试并不等于表现为零。",
        "assumptions": [],
        "confidence": "unknown"
      }
    }
  }
}
