{
  "score_version": "dual-track-v1",
  "reference_only": false,
  "id": "enrich-and-store-contacts-in-a-personal-crm",
  "profile_id": "solo-generalist-v1",
  "analysis_depth": "brief",
  "commercial": {
    "total": null,
    "dimensions": {
      "demand_payment": {
        "score": null,
        "evidence_ids": [],
        "rationale": "目前资料不足以支持该维锚点；未测试并不等于表现为零。",
        "assumptions": [],
        "confidence": "unknown"
      },
      "acquisition": {
        "score": null,
        "evidence_ids": [],
        "rationale": "目前资料不足以支持该维锚点；未测试并不等于表现为零。",
        "assumptions": [],
        "confidence": "unknown"
      },
      "delivery_economics": {
        "score": 2,
        "evidence_ids": [
          "archive"
        ],
        "rationale": "透明情景保留有限正贡献，但工时、数据采购和客户需求未验证，月维护贡献很薄。",
        "assumptions": [],
        "confidence": "low"
      },
      "differentiation": {
        "score": 2,
        "evidence_ids": [
          "archive"
        ],
        "rationale": "归档描述富集、会议笔记与自然语言检索组合便利；没有对照或可积累壁垒，只支持有限差异。",
        "assumptions": [],
        "confidence": "low"
      },
      "validation_replication": {
        "score": null,
        "evidence_ids": [],
        "rationale": "目前资料不足以支持该维锚点；未测试并不等于表现为零。",
        "assumptions": [],
        "confidence": "unknown"
      }
    }
  },
  "personal": {
    "total": null,
    "dimensions": {
      "audience_frequency": {
        "score": null,
        "evidence_ids": [],
        "rationale": "目前资料不足以支持该维锚点；未测试并不等于表现为零。",
        "assumptions": [],
        "confidence": "unknown"
      },
      "net_benefit": {
        "score": null,
        "evidence_ids": [],
        "rationale": "目前资料不足以支持该维锚点；未测试并不等于表现为零。",
        "assumptions": [],
        "confidence": "unknown"
      },
      "reliability": {
        "score": null,
        "evidence_ids": [],
        "rationale": "目前资料不足以支持该维锚点；未测试并不等于表现为零。",
        "assumptions": [],
        "confidence": "unknown"
      },
      "setup_maintenance": {
        "score": null,
        "evidence_ids": [],
        "rationale": "目前资料不足以支持该维锚点；未测试并不等于表现为零。",
        "assumptions": [],
        "confidence": "unknown"
      },
      "cost_data_control": {
        "score": null,
        "evidence_ids": [],
        "rationale": "目前资料不足以支持该维锚点；未测试并不等于表现为零。",
        "assumptions": [],
        "confidence": "unknown"
      }
    }
  }
}
